{
  "priorities": {
    "critical": {
      "keywords": [
        "critical",
        "bug",
        "security",
        "vulnerability",
        "broken",
        "error",
        "failure",
        "crash",
        "è‡´å‘½çš„",
        "ã‚»ã‚­ãƒ¥ãƒªãƒ†ã‚£",
        "è„†å¼±æ€§"
      ],
      "emoji": "ğŸ”´"
    },
    "high": {
      "keywords": [
        "important",
        "major",
        "should fix",
        "required",
        "blocking",
        "urgent",
        "å¿…é ˆ",
        "é‡è¦",
        "ç·Šæ€¥"
      ],
      "emoji": "ğŸŸ "
    },
    "major": {
      "keywords": [
        "consider",
        "recommend",
        "improvement",
        "optimize",
        "refactor",
        "æ¨å¥¨",
        "æ”¹å–„",
        "æœ€é©åŒ–"
      ],
      "emoji": "ğŸŸ¡"
    },
    "minor": {
      "keywords": [
        "nit",
        "style",
        "formatting",
        "typo",
        "suggestion",
        "optional",
        "è»½å¾®",
        "ã‚¹ã‚¿ã‚¤ãƒ«",
        "ææ¡ˆ"
      ],
      "emoji": "ğŸŸ¢"
    }
  },
  "categories": {
    "security": {
      "keywords": [
        "security",
        "vulnerability",
        "auth",
        "authentication",
        "authorization",
        "permission",
        "xss",
        "sql injection",
        "csrf",
        "ã‚»ã‚­ãƒ¥ãƒªãƒ†ã‚£",
        "èªè¨¼",
        "èªå¯"
      ],
      "description": "Security-related issues"
    },
    "performance": {
      "keywords": [
        "performance",
        "slow",
        "optimization",
        "cache",
        "memory",
        "cpu",
        "ãƒ‘ãƒ•ã‚©ãƒ¼ãƒãƒ³ã‚¹",
        "æœ€é©åŒ–",
        "ãƒ¡ãƒ¢ãƒª"
      ],
      "description": "Performance optimization"
    },
    "bug": {
      "keywords": [
        "bug",
        "error",
        "broken",
        "fail",
        "incorrect",
        "wrong",
        "ãƒã‚°",
        "ã‚¨ãƒ©ãƒ¼",
        "ä¸å…·åˆ"
      ],
      "description": "Bug fixes"
    },
    "style": {
      "keywords": [
        "style",
        "format",
        "formatting",
        "naming",
        "convention",
        "prettier",
        "eslint",
        "lint",
        "ã‚¹ã‚¿ã‚¤ãƒ«",
        "ãƒ•ã‚©ãƒ¼ãƒãƒƒãƒˆ"
      ],
      "description": "Code style and formatting"
    },
    "refactor": {
      "keywords": [
        "refactor",
        "clean",
        "simplify",
        "duplication",
        "dry",
        "ãƒªãƒ•ã‚¡ã‚¯ã‚¿ãƒªãƒ³ã‚°",
        "é‡è¤‡",
        "ç°¡ç´ åŒ–"
      ],
      "description": "Code refactoring"
    },
    "test": {
      "keywords": ["test", "testing", "coverage", "mock", "assertion", "ãƒ†ã‚¹ãƒˆ", "ã‚«ãƒãƒ¬ãƒƒã‚¸"],
      "description": "Testing improvements"
    },
    "docs": {
      "keywords": ["documentation", "comment", "readme", "doc", "èª¬æ˜", "ãƒ‰ã‚­ãƒ¥ãƒ¡ãƒ³ãƒˆ", "ã‚³ãƒ¡ãƒ³ãƒˆ"],
      "description": "Documentation updates"
    },
    "accessibility": {
      "keywords": ["accessibility", "a11y", "aria", "screen reader", "ã‚¢ã‚¯ã‚»ã‚·ãƒ“ãƒªãƒ†ã‚£"],
      "description": "Accessibility improvements"
    },
    "i18n": {
      "keywords": [
        "i18n",
        "internationalization",
        "localization",
        "translation",
        "å›½éš›åŒ–",
        "å¤šè¨€èª"
      ],
      "description": "Internationalization"
    }
  },
  "bots": {
    "coderabbitai": {
      "username": "coderabbitai",
      "trusted": true,
      "priority_boost": 0
    },
    "github-actions": {
      "username": "github-actions",
      "trusted": true,
      "priority_boost": 0
    },
    "dependabot": {
      "username": "dependabot",
      "trusted": true,
      "priority_boost": 0
    },
    "renovate": {
      "username": "renovate",
      "trusted": true,
      "priority_boost": 0
    },
    "sonarcloud": {
      "username": "sonarcloud",
      "trusted": true,
      "priority_boost": 1
    }
  },
  "paths": {
    "tracking_file": "docs/_review-fixes.md"
  },
  "quality_gates": {
    "type_check": true,
    "lint": true,
    "test": false,
    "auto_rollback": true
  },
  "output": {
    "language": "ja",
    "verbose": false
  }
}
